{
  "schema_id": "urn:dosai:schema:acceptance-fixture-manifest:2",
  "schema_version": 2,
  "manifest_id": "c643ff82-fbd4-4a26-ba00-6781bfad279d",
  "created_at": "2026-07-31T22:06:47.000Z",
  "data_class": "D5",
  "catalog_version": 4,
  "suite_id": "P1-AT-003",
  "fixture_version": 2,
  "status": "ACCEPTED",
  "runner": { "id": "dosai-acceptance", "version": "0.1.1" },
  "secret_canary_set_version": 1,
  "platform_profiles": ["MACOS_ARM64_V1"],
  "required_artifacts": ["REPORT", "ASSERTIONS", "ENVIRONMENT", "COMMAND", "PERFORMANCE", "CLEANUP"],
  "cases": [
    {
      "id": "P1-AT-003-S01-C01",
      "scenario_id": "P1-AT-003-S01",
      "mode": "NEGATIVE",
      "handler_id": "P1_REQUEST_REJECTION",
      "input_profile": "BOUNDARY_REQUEST_ATTACKS_V1",
      "input_digest": { "algorithm": "SHA-256", "value": "e002c209c37499b6235a57871090efab7928a477987bad61ba6f314b43591ff9" },
      "input_data_class": "D5",
      "preconditions": ["CLEAN_REPOSITORY", "PACKAGED_SHELL_AVAILABLE"],
      "setup_operations": ["CREATE_ISOLATED_PROFILE"],
      "action_deadline_ms": 60000,
      "assertions": [
        { "id": "P1_BOUNDARY_DUPLICATE_READ_STABLE", "expected_code": "ASSERTION_PASS", "artifact_classes": ["ASSERTIONS"] },
        { "id": "P1_SESSION_EXTERNAL_FETCH_REJECTED", "expected_code": "ASSERTION_PASS", "artifact_classes": ["ASSERTIONS"] },
        { "id": "P1_SESSION_FILE_FETCH_REJECTED", "expected_code": "ASSERTION_PASS", "artifact_classes": ["ASSERTIONS"] },
        { "id": "P1_NAVIGATION_HOSTILE_DENIED", "expected_code": "ASSERTION_PASS", "artifact_classes": ["ASSERTIONS"] },
        { "id": "P1_NAVIGATION_EXTERNAL_PROTOCOL_DENIED", "expected_code": "ASSERTION_PASS", "artifact_classes": ["ASSERTIONS"] }
      ],
      "expected_external_effect": "NONE",
      "cancellation_postcondition": "OWNED_PROCESS_GROUP_TERMINATED",
      "teardown_postconditions": ["ISOLATED_PROFILE_REMOVED", "OWNED_PROCESS_GROUP_TERMINATED"],
      "retention_profile": "R3_EVIDENCE_STANDARD",
      "deletion_postcondition": "MANAGED_EVIDENCE_ONLY",
      "eligible_claims": ["P1.3", "P1.4", "T04"],
      "limitations": []
    },
    {
      "id": "P1-AT-003-S02-C01",
      "scenario_id": "P1-AT-003-S02",
      "mode": "LOAD",
      "handler_id": "P1_TYPED_BRIDGE_LOAD",
      "input_profile": "TYPED_BRIDGE_LOAD_2000_V1",
      "input_digest": { "algorithm": "SHA-256", "value": "0a30b81d83ea71c90473733de71b5732115430ff3d6937a1f291b8e3b256817a" },
      "input_data_class": "D5",
      "preconditions": ["CLEAN_REPOSITORY", "PACKAGED_SHELL_AVAILABLE"],
      "setup_operations": ["CREATE_ISOLATED_PROFILE"],
      "action_deadline_ms": 60000,
      "assertions": [
        { "id": "P1_LOAD_READS_STABLE", "expected_code": "ASSERTION_PASS", "artifact_classes": ["PERFORMANCE"] },
        { "id": "P1_LOAD_UI_REACHABLE", "expected_code": "ASSERTION_PASS", "artifact_classes": ["PERFORMANCE"] },
        { "id": "P1_LOAD_TIMER_RESPONSIVE", "expected_code": "ASSERTION_PASS", "artifact_classes": ["PERFORMANCE"] },
        { "id": "P1_LOAD_BOUNDED", "expected_code": "ASSERTION_PASS", "artifact_classes": ["PERFORMANCE"] },
        { "id": "P1_CLEANUP_PROCESS_GROUP", "expected_code": "ASSERTION_PASS", "artifact_classes": ["CLEANUP"] },
        { "id": "P1_CLEANUP_ISOLATED_PROFILE", "expected_code": "ASSERTION_PASS", "artifact_classes": ["CLEANUP"] },
        { "id": "P1_WORKTREE_REMAINS_CLEAN", "expected_code": "ASSERTION_PASS", "artifact_classes": ["CLEANUP"] }
      ],
      "expected_external_effect": "NONE",
      "cancellation_postcondition": "OWNED_PROCESS_GROUP_TERMINATED",
      "teardown_postconditions": ["ISOLATED_PROFILE_REMOVED", "OWNED_PROCESS_GROUP_TERMINATED"],
      "retention_profile": "R3_EVIDENCE_STANDARD",
      "deletion_postcondition": "MANAGED_EVIDENCE_ONLY",
      "eligible_claims": ["P1.EXIT", "T07"],
      "limitations": ["FIXED_READ_ONLY_LOAD"]
    }
  ]
}
