{
  "schema_id": "urn:dosai:schema:acceptance-fixture-manifest:2",
  "schema_version": 2,
  "manifest_id": "87d0c91a-2607-47cd-8c0b-d5e912f2a6cc",
  "created_at": "2026-07-31T22:06:47.000Z",
  "data_class": "D5",
  "catalog_version": 4,
  "suite_id": "P1-AT-002",
  "fixture_version": 2,
  "status": "ACCEPTED",
  "runner": { "id": "dosai-acceptance", "version": "0.1.1" },
  "secret_canary_set_version": 1,
  "platform_profiles": ["MACOS_ARM64_V1"],
  "required_artifacts": ["REPORT", "ASSERTIONS", "ENVIRONMENT", "COMMAND", "PACKAGE", "MANIFEST", "CLEANUP"],
  "cases": [
    {
      "id": "P1-AT-002-S01-C01",
      "scenario_id": "P1-AT-002-S01",
      "mode": "SECURITY",
      "handler_id": "P1_RUNTIME_BOUNDARY",
      "input_profile": "PACKAGED_RUNTIME_BOUNDARY_V1",
      "input_digest": { "algorithm": "SHA-256", "value": "d3d0441d9fd448e5c9c1c11bae256d0ee0345056ca7f6cf16aa3968b45b25b7b" },
      "input_data_class": "D5",
      "preconditions": ["CLEAN_REPOSITORY", "PACKAGED_SHELL_AVAILABLE"],
      "setup_operations": ["CREATE_ISOLATED_PROFILE"],
      "action_deadline_ms": 60000,
      "assertions": [
        { "id": "P1_BOUNDARY_NODE_GLOBALS_ABSENT", "expected_code": "ASSERTION_PASS", "artifact_classes": ["ASSERTIONS"] },
        { "id": "P1_BOUNDARY_BRIDGE_EXACT", "expected_code": "ASSERTION_PASS", "artifact_classes": ["ASSERTIONS"] },
        { "id": "P1_BOUNDARY_BRIDGE_FROZEN", "expected_code": "ASSERTION_PASS", "artifact_classes": ["ASSERTIONS"] },
        { "id": "P1_CSP_INLINE_SCRIPT_BLOCKED", "expected_code": "ASSERTION_PASS", "artifact_classes": ["ASSERTIONS"] },
        { "id": "P1_CSP_NODE_IMPORT_REJECTED", "expected_code": "ASSERTION_PASS", "artifact_classes": ["ASSERTIONS"] },
        { "id": "P1_SESSION_POPUP_DENIED", "expected_code": "ASSERTION_PASS", "artifact_classes": ["ASSERTIONS"] },
        { "id": "P1_SESSION_PERMISSION_DENIED", "expected_code": "ASSERTION_PASS", "artifact_classes": ["ASSERTIONS"] }
      ],
      "expected_external_effect": "NONE",
      "cancellation_postcondition": "OWNED_PROCESS_GROUP_TERMINATED",
      "teardown_postconditions": ["ISOLATED_PROFILE_REMOVED", "OWNED_PROCESS_GROUP_TERMINATED"],
      "retention_profile": "R3_EVIDENCE_STANDARD",
      "deletion_postcondition": "MANAGED_EVIDENCE_ONLY",
      "eligible_claims": ["P1.2", "P1.3", "I02", "I03"],
      "limitations": []
    },
    {
      "id": "P1-AT-002-S02-C01",
      "scenario_id": "P1-AT-002-S02",
      "mode": "NEGATIVE",
      "handler_id": "P1_AUTHORITY_CORPUS",
      "input_profile": "RENDERER_AUTHORITY_ATTACKS_V1",
      "input_digest": { "algorithm": "SHA-256", "value": "0c2c41ef99e4a81531229c616dd3c8cb3d40c629efcb4b7a026efffcdb030751" },
      "input_data_class": "D5",
      "preconditions": ["CLEAN_REPOSITORY", "PACKAGED_SHELL_AVAILABLE"],
      "setup_operations": ["CREATE_ISOLATED_PROFILE"],
      "action_deadline_ms": 60000,
      "assertions": [
        { "id": "P1_AUTHORITY_CORPUS_REJECTED", "expected_code": "ASSERTION_PASS", "artifact_classes": ["ASSERTIONS"] },
        { "id": "P1_BOUNDARY_UNKNOWN_METHOD_ABSENT", "expected_code": "ASSERTION_PASS", "artifact_classes": ["ASSERTIONS"] },
        { "id": "P1_BOUNDARY_EXTRA_ARGUMENT_REJECTED", "expected_code": "ASSERTION_PASS", "artifact_classes": ["ASSERTIONS"] },
        { "id": "P1_BOUNDARY_OVERSIZED_ARGUMENT_REJECTED", "expected_code": "ASSERTION_PASS", "artifact_classes": ["ASSERTIONS"] },
        { "id": "P1_BOUNDARY_SUBFRAME_UNAVAILABLE", "expected_code": "ASSERTION_PASS", "artifact_classes": ["ASSERTIONS"] },
        { "id": "P1_CLEANUP_PROCESS_GROUP", "expected_code": "ASSERTION_PASS", "artifact_classes": ["CLEANUP"] },
        { "id": "P1_CLEANUP_ISOLATED_PROFILE", "expected_code": "ASSERTION_PASS", "artifact_classes": ["CLEANUP"] },
        { "id": "P1_WORKTREE_REMAINS_CLEAN", "expected_code": "ASSERTION_PASS", "artifact_classes": ["CLEANUP"] }
      ],
      "expected_external_effect": "NONE",
      "cancellation_postcondition": "OWNED_PROCESS_GROUP_TERMINATED",
      "teardown_postconditions": ["ISOLATED_PROFILE_REMOVED", "OWNED_PROCESS_GROUP_TERMINATED"],
      "retention_profile": "R3_EVIDENCE_STANDARD",
      "deletion_postcondition": "MANAGED_EVIDENCE_ONLY",
      "eligible_claims": ["P1.4", "I02", "I03"],
      "limitations": []
    }
  ]
}
